{
  "job_name": "bounded_search_1773582246",
  "hypothesis": "Test autosearch bounded mutation (LangGraph)",
  "policy_path": "config\\generated\\policy_candidate_1773582246.json",
  "manifest_path": "config\\generated\\manifest_candidate_1773582246.json",
  "job_version": 1,
  "tags": [
    "autosearch",
    "bounded_search"
  ],
  "metadata": {
    "orchestrator": "bounded_autosearch_v1",
    "candidate_id": "1773582246",
    "base_policy_path": "config\\policy_vmax_only.json",
    "base_manifest_path": "config\\rbc_core_km_only_benchmarks.json",
    "mutation_summary": "Mutated atp_penalty_weight from 8.0 to 10.0"
  }
}